{
  "$schema": "https://json-schema.org/draft/2020-12/schema",
  "$id": "https://github.com/HelloHQ/plugin-registry/schema/manifest.schema.json",
  "title": "HelloHQ Plugin Manifest",
  "description": "One manifest.json per plugin lives at plugins/<id>/manifest.json. Validated by registry CI on every PR.",
  "type": "object",
  "additionalProperties": false,
  "required": [
    "id",
    "name",
    "version",
    "description",
    "author",
    "author_url",
    "repo",
    "license",
    "min_host_version",
    "wasm_url",
    "content_hash_sha256",
    "permissions"
  ],
  "properties": {
    "id": {
      "type": "string",
      "description": "Reverse-domain identifier. Frozen at first submission. The 'hellohq.' prefix is reserved for Official plugins.",
      "pattern": "^[a-z][a-z0-9]*(\\.[a-z0-9][a-z0-9-]*)+$",
      "maxLength": 128
    },
    "name": { "type": "string", "maxLength": 60 },
    "version": {
      "type": "string",
      "pattern": "^[0-9]+\\.[0-9]+\\.[0-9]+(-[0-9A-Za-z.-]+)?$"
    },
    "description": { "type": "string", "maxLength": 200 },
    "author": { "type": "string", "minLength": 1 },
    "author_url": { "type": "string", "format": "uri" },
    "repo": { "type": "string", "format": "uri" },
    "license": { "type": "string", "minLength": 1 },
    "categories": {
      "type": "array",
      "maxItems": 3,
      "items": {
        "enum": [
          "analytics",
          "import",
          "export",
          "productivity",
          "finance",
          "reporting",
          "utilities",
          "charts",
          "integration"
        ]
      }
    },
    "min_host_version": {
      "type": "string",
      "pattern": "^[0-9]+\\.[0-9]+\\.[0-9]+$"
    },
    "execution_mode": {
      "enum": ["wasm", "sidecar"],
      "default": "wasm",
      "description": "sidecar (Tier 1 Python) requires trust_tier: verified and is desktop-only."
    },
    "wasm_url": { "type": "string", "format": "uri" },
    "content_hash_sha256": {
      "type": "string",
      "pattern": "^[a-f0-9]{64}$",
      "description": "Lowercase hex SHA-256 of the file at wasm_url. Verified by CI and by the app before every execution."
    },
    "ui_bundle_url": { "type": "string", "format": "uri" },
    "ui_bundle_hash_sha256": { "type": "string", "pattern": "^[a-f0-9]{64}$" },
    "ui_type": {
      "enum": ["declarative", "webview", "headless"],
      "default": "declarative"
    },
    "sidebar_icon": {
      "type": "string",
      "description": "24x24 single-fill SVG: an https URL, or for a webview plugin a path inside the UI bundle. An https icon needs sidebar_icon_hash_sha256. Invalid icons fall back to a generic glyph."
    },
    "sidebar_icon_hash_sha256": {
      "type": "string",
      "pattern": "^[a-f0-9]{64}$",
      "description": "Lowercase hex SHA-256 of the SVG served at an https sidebar_icon. The app downloads the icon once at install, checks this hash and draws the local copy; it never loads an unpinned icon from the network. CI verifies it, caps the file at 64 KiB and rejects scripts, foreignObject, event handlers and external references."
    },
    "entry_function": { "type": "string", "default": "run" },
    "permissions": {
      "type": "array",
      "items": {
        "type": "object",
        "additionalProperties": false,
        "properties": {
          "id": {
            "enum": [
              "read:portfolio_names",
              "read:sheet_structure",
              "read:asset_count",
              "read:currency_rates",
              "read:aggregated_values",
              "write:external_output",
              "read:external_input",
              "plugin:storage",
              "network:fetch",
              "ai:inference",
              "propose:holdings",
              "propose:valuations"
            ]
          },
          "scope": { "type": "object" },
          "reason": {
            "type": "string",
            "minLength": 1,
            "maxLength": 240,
            "description": "One plain sentence shown to the person in the install dialog: why this plugin needs the permission. Optional; the host never uses it to decide anything."
          }
        },
        "required": ["id"],
        "allOf": [
          {
            "$comment": "propose:holdings / propose:valuations let a plugin SUGGEST a holding or a value that the person must approve in the app; they are Verified-only and require scope {\"kinds\": [...]} naming the asset kinds the plugin may propose. A missing scope is never read as 'any kind'. The kind enum is closed and MUST equal PluginProposePermission.kinds in HelloHQ/hellohq (lib/app/data/model/plugin/plugin_propose_scope.dart); hellohq has a test that compares the vendored copy of this schema with that set. The Verified-only tier check is in .github/workflows/validate.yml.",
            "if": {
              "properties": { "id": { "enum": ["propose:holdings", "propose:valuations"] } },
              "required": ["id"]
            },
            "then": {
              "required": ["scope"],
              "properties": {
                "scope": {
                  "type": "object",
                  "additionalProperties": false,
                  "required": ["kinds"],
                  "properties": {
                    "kinds": {
                      "type": "array",
                      "minItems": 1,
                      "uniqueItems": true,
                      "items": {
                        "enum": [
                          "stock_ticker",
                          "crypto_ticker",
                          "crypto_exchange",
                          "home",
                          "car",
                          "precious_metal",
                          "domain",
                          "loan_mortgage"
                        ]
                      }
                    }
                  }
                }
              }
            }
          }
        ]
      }
    },
    "trust_tier": {
      "enum": ["community", "verified", "official"],
      "description": "Assigned by the registry team at merge — do not set this yourself. Governs which capabilities the plugin may declare. community (default): Wasm-only, declarative/headless UI, no ai:inference, no write:external_output, no propose:*, no sidecar. verified: unlocks sidecar execution, ai:inference, write:external_output, propose:holdings, propose:valuations, and webview UI after manual Verified review. official: HelloHQ first-party plugins (hellohq.* id prefix)."
    },
    "provenance": {
      "enum": ["core", "community", "enterprise"],
      "default": "community",
      "description": "Who built the plugin. 'core' is reserved for HelloHQ (requires an official signature) and is rejected from outside authors by CI. 'enterprise' is private to the org that built it and MUST NOT appear in the public registry — CI rejects it (see REVIEW_POLICY). Defaults to community."
    },
    "licensing": {
      "type": "object",
      "additionalProperties": false,
      "description": "Open-source vs commercial status. Surfaced as a badge in the in-app Plugin Browser so users see licensing before installing.",
      "properties": {
        "kind": { "enum": ["open_source", "commercial"], "default": "open_source" },
        "spdx": {
          "type": "string",
          "description": "SPDX licence identifier for open-source plugins, e.g. MIT, Apache-2.0."
        },
        "product_id": {
          "type": "string",
          "description": "HelloHQ-brokered marketplace SKU. Required when kind == commercial."
        },
        "price_cents": { "type": "integer", "minimum": 0 },
        "currency": { "type": "string", "pattern": "^[A-Z]{3}$", "default": "USD" },
        "pricing_model": { "enum": ["one_time", "subscription"] },
        "info_url": { "type": "string", "format": "uri" }
      }
    },
    "publisher_signing_key_id": {
      "type": "string",
      "description": "Assigned by the registry team at merge. Omit on first submission."
    },
    "signatures": {
      "type": "array",
      "description": "SA5: detached HYBRID publisher signatures, added by the registry signing pipeline after merge — do not set this yourself; omit on first submission. Each signature covers the artifact statement built by scripts/artifact-statement.mjs (plugin id, version, trust tier, execution mode, content_hash_sha256 and ui_bundle_hash_sha256), not the file itself: the app rebuilds that statement after checking the downloaded file against content_hash_sha256. A signed tier needs a valid Ed25519 AND a valid ML-DSA-65 signature from a trusted publisher key, fail-closed. Enforcement activates once the matching publisher keys are bundled in the app.",
      "items": {
        "type": "object",
        "additionalProperties": false,
        "properties": {
          "sig_alg": { "enum": ["ed25519", "ml-dsa-65"] },
          "key_id": { "type": "string", "pattern": "^[A-Za-z0-9._-]+$" },
          "signature": { "type": "string", "minLength": 1, "description": "Base64 detached signature over the artifact statement bytes." }
        },
        "required": ["sig_alg", "key_id", "signature"]
      }
    },
    "author_cert": {
      "type": "string",
      "minLength": 1,
      "maxLength": 16384,
      "pattern": "^[A-Za-z0-9+/]+={0,2}$",
      "description": "Doc 25/27: base64 of the EXACT bytes of the registry-issued author certificate (scripts/author-cert.mjs) whose keys made this plugin's signatures[]. The certificate lists the id_prefixes that author may sign. Added by the signing pipeline after merge — do not set this yourself. The app verifies the certificate's registry-root signature over these exact bytes, its validity window, its presence in the signed index manifest's valid_author_cert_ids, then verifies signatures[] with the certificate's keys. That the plugin id sits under one of the certificate's id_prefixes is enforced by registry CI, the signing pipeline and the app, which refuses a certificate that lists none."
    },
    "author_cert_sig": {
      "type": "object",
      "additionalProperties": false,
      "required": ["signatures"],
      "description": "The registry root's hybrid signatures over the decoded author_cert bytes. Added by the signing pipeline; present exactly when author_cert is.",
      "properties": {
        "signatures": {
          "type": "array",
          "minItems": 1,
          "items": {
            "type": "object",
            "additionalProperties": false,
            "properties": {
              "sig_alg": { "enum": ["ed25519", "ml-dsa-65"] },
              "key_id": { "type": "string", "pattern": "^[A-Za-z0-9._-]+$" },
              "signature": { "type": "string", "minLength": 1 }
            },
            "required": ["sig_alg", "key_id", "signature"]
          }
        }
      }
    }
  },
  "dependentRequired": {
    "author_cert": ["author_cert_sig"],
    "author_cert_sig": ["author_cert"]
  },
  "allOf": [
    {
      "if": { "properties": { "ui_type": { "const": "webview" } } },
      "then": { "required": ["ui_bundle_url", "ui_bundle_hash_sha256"] }
    },
    {
      "$comment": "read:aggregated_values requires an explicit portfolio scope, except in a first-party plugin (trust_tier official with provenance core, both set by the registry team): it needs every portfolio and cannot know a person's portfolio ids in advance. A grant without a scope covers all portfolios; the install dialog still shows it.",
      "if": {
        "allOf": [
          {
            "properties": {
              "permissions": {
                "contains": { "properties": { "id": { "const": "read:aggregated_values" } }, "required": ["id"] }
              }
            }
          },
          {
            "not": {
              "properties": { "trust_tier": { "const": "official" }, "provenance": { "const": "core" } },
              "required": ["trust_tier", "provenance"]
            }
          }
        ]
      },
      "then": {
        "properties": {
          "permissions": {
            "contains": {
              "properties": {
                "id": { "const": "read:aggregated_values" },
                "scope": { "type": "object", "required": ["portfolios"] }
              },
              "required": ["id", "scope"]
            }
          }
        }
      }
    },
    {
      "$comment": "network:fetch requires a non-empty origins allowlist on the permission scope. The app reads the allowlist from this scope (scope.origins), never from a top-level block. Entries are bare hostnames or a single-label wildcard (e.g. api.example.com, *.cdn.example.com) — no scheme, port, or path.",
      "if": {
        "properties": {
          "permissions": {
            "contains": { "properties": { "id": { "const": "network:fetch" } }, "required": ["id"] }
          }
        }
      },
      "then": {
        "properties": {
          "permissions": {
            "contains": {
              "properties": {
                "id": { "const": "network:fetch" },
                "scope": {
                  "type": "object",
                  "required": ["origins"],
                  "properties": {
                    "origins": {
                      "type": "array",
                      "minItems": 1,
                      "maxItems": 10,
                      "items": {
                        "type": "string",
                        "pattern": "^(\\*\\.)?[a-z0-9]([a-z0-9-]*[a-z0-9])?(\\.[a-z0-9]([a-z0-9-]*[a-z0-9])?)+$"
                      }
                    }
                  }
                }
              },
              "required": ["id", "scope"]
            }
          }
        }
      }
    },
    {
      "$comment": "Commercial plugins must carry a HelloHQ-brokered marketplace SKU.",
      "if": {
        "properties": {
          "licensing": {
            "properties": { "kind": { "const": "commercial" } },
            "required": ["kind"]
          }
        },
        "required": ["licensing"]
      },
      "then": {
        "properties": {
          "licensing": { "required": ["product_id"] }
        }
      }
    }
  ]
}
